[
  {
    "code": "manifest.yaml.anchor",
    "severity": "error",
    "subject": {
      "kind": "manifest"
    },
    "location": {
      "origin": "package",
      "file": "metais.yaml",
      "line": 9,
      "column": 5,
      "pointer": "/outputs/0"
    },
    "params": {}
  },
  {
    "code": "manifest.yaml.alias",
    "severity": "error",
    "subject": {
      "kind": "manifest"
    },
    "location": {
      "origin": "package",
      "file": "metais.yaml",
      "line": 15,
      "column": 11,
      "pointer": "/outputs/0/container/entries/1"
    },
    "params": {}
  }
]
