[
  {
    "code": "template.unknown_filter",
    "severity": "error",
    "subject": {
      "kind": "template",
      "name": "templates/a.txt.liquid"
    },
    "location": {
      "origin": "package",
      "file": "templates/a.txt.liquid",
      "line": 1,
      "column": 1
    },
    "params": {
      "filter": "money_without_currency",
      "column": 1,
      "alternative": "amount"
    }
  }
]
