[
  {
    "code": "manifest.pattern",
    "severity": "error",
    "subject": {
      "kind": "manifest"
    },
    "location": {
      "origin": "package",
      "file": "metais.yaml",
      "line": 4,
      "column": 11,
      "pointer": "/homepage"
    },
    "schema": {
      "entry": "https://metais.org/schemas/1.0/manifest.schema.json",
      "pointer": "/$defs/http_uri/pattern",
      "keyword": "pattern"
    },
    "field": {
      "title": "Homepage",
      "description": "An absolute https or http URI of at most 2048 characters, the scheme in lower case, with a non-empty host, no user information and no fragment."
    },
    "params": {
      "pattern": "^https?://(([-A-Za-z0-9._~!$&'()*+,;=]|%[0-9A-Fa-f]{2})+|\\[((([0-9A-Fa-f]{1,4}:){6}([0-9A-Fa-f]{1,4}:[0-9A-Fa-f]{1,4}|(25[0-5]|2[0-4][0-9]|1[0-9][0-9]|[1-9]?[0-9])\\.(25[0-5]|2[0-4][0-9]|1[0-9][0-9]|[1-9]?[0-9])\\.(25[0-5]|2[0-4][0-9]|1[0-9][0-9]|[1-9]?[0-9])\\.(25[0-5]|2[0-4][0-9]|1[0-9][0-9]|[1-9]?[0-9]))|::([0-9A-Fa-f]{1,4}:){5}([0-9A-Fa-f]{1,4}:[0-9A-Fa-f]{1,4}|(25[0-5]|2[0-4][0-9]|1[0-9][0-9]|[1-9]?[0-9])\\.(25[0-5]|2[0-4][0-9]|1[0-9][0-9]|[1-9]?[0-9])\\.(25[0-5]|2[0-4][0-9]|1[0-9][0-9]|[1-9]?[0-9])\\.(25[0-5]|2[0-4][0-9]|1[0-9][0-9]|[1-9]?[0-9]))|([0-9A-Fa-f]{1,4})?::([0-9A-Fa-f]{1,4}:){4}([0-9A-Fa-f]{1,4}:[0-9A-Fa-f]{1,4}|(25[0-5]|2[0-4][0-9]|1[0-9][0-9]|[1-9]?[0-9])\\.(25[0-5]|2[0-4][0-9]|1[0-9][0-9]|[1-9]?[0-9])\\.(25[0-5]|2[0-4][0-9]|1[0-9][0-9]|[1-9]?[0-9])\\.(25[0-5]|2[0-4][0-9]|1[0-9][0-9]|[1-9]?[0-9]))|(([0-9A-Fa-f]{1,4}:){0,1}[0-9A-Fa-f]{1,4})?::([0-9A-Fa-f]{1,4}:){3}([0-9A-Fa-f]{1,4}:[0-9A-Fa-f]{1,4}|(25[0-5]|2[0-4][0-9]|1[0-9][0-9]|[1-9]?[0-9])\\.(25[0-5]|2[0-4][0-9]|1[0-9][0-9]|[1-9]?[0-9])\\.(25[0-5]|2[0-4][0-9]|1[0-9][0-9]|[1-9]?[0-9])\\.(25[0-5]|2[0-4][0-9]|1[0-9][0-9]|[1-9]?[0-9]))|(([0-9A-Fa-f]{1,4}:){0,2}[0-9A-Fa-f]{1,4})?::([0-9A-Fa-f]{1,4}:){2}([0-9A-Fa-f]{1,4}:[0-9A-Fa-f]{1,4}|(25[0-5]|2[0-4][0-9]|1[0-9][0-9]|[1-9]?[0-9])\\.(25[0-5]|2[0-4][0-9]|1[0-9][0-9]|[1-9]?[0-9])\\.(25[0-5]|2[0-4][0-9]|1[0-9][0-9]|[1-9]?[0-9])\\.(25[0-5]|2[0-4][0-9]|1[0-9][0-9]|[1-9]?[0-9]))|(([0-9A-Fa-f]{1,4}:){0,3}[0-9A-Fa-f]{1,4})?::[0-9A-Fa-f]{1,4}:([0-9A-Fa-f]{1,4}:[0-9A-Fa-f]{1,4}|(25[0-5]|2[0-4][0-9]|1[0-9][0-9]|[1-9]?[0-9])\\.(25[0-5]|2[0-4][0-9]|1[0-9][0-9]|[1-9]?[0-9])\\.(25[0-5]|2[0-4][0-9]|1[0-9][0-9]|[1-9]?[0-9])\\.(25[0-5]|2[0-4][0-9]|1[0-9][0-9]|[1-9]?[0-9]))|(([0-9A-Fa-f]{1,4}:){0,4}[0-9A-Fa-f]{1,4})?::([0-9A-Fa-f]{1,4}:[0-9A-Fa-f]{1,4}|(25[0-5]|2[0-4][0-9]|1[0-9][0-9]|[1-9]?[0-9])\\.(25[0-5]|2[0-4][0-9]|1[0-9][0-9]|[1-9]?[0-9])\\.(25[0-5]|2[0-4][0-9]|1[0-9][0-9]|[1-9]?[0-9])\\.(25[0-5]|2[0-4][0-9]|1[0-9][0-9]|[1-9]?[0-9]))|(([0-9A-Fa-f]{1,4}:){0,5}[0-9A-Fa-f]{1,4})?::[0-9A-Fa-f]{1,4}|(([0-9A-Fa-f]{1,4}:){0,6}[0-9A-Fa-f]{1,4})?::)|v[0-9A-Fa-f]+\\.[-A-Za-z0-9._~!$&'()*+,;=:]+)\\])(:[0-9]*)?(/([-A-Za-z0-9._~!$&'()*+,;=:@]|%[0-9A-Fa-f]{2})*)*(\\?(([-A-Za-z0-9._~!$&'()*+,;=:@]|%[0-9A-Fa-f]{2})|[/?])*)?$"
    }
  },
  {
    "code": "manifest.max_length",
    "severity": "error",
    "subject": {
      "kind": "manifest"
    },
    "location": {
      "origin": "package",
      "file": "metais.yaml",
      "line": 5,
      "column": 8,
      "pointer": "/title"
    },
    "schema": {
      "entry": "https://metais.org/schemas/1.0/manifest.schema.json",
      "pointer": "/properties/title/maxLength",
      "keyword": "maxLength"
    },
    "field": {
      "title": "Title",
      "description": "What the package is, as a person names it: one line of 1 to 200 characters."
    },
    "params": {
      "limit": 200,
      "length": 201
    }
  },
  {
    "code": "manifest.pattern",
    "severity": "error",
    "subject": {
      "kind": "manifest"
    },
    "location": {
      "origin": "package",
      "file": "metais.yaml",
      "line": 6,
      "column": 14,
      "pointer": "/description"
    },
    "schema": {
      "entry": "https://metais.org/schemas/1.0/manifest.schema.json",
      "pointer": "/$defs/prose/pattern",
      "keyword": "pattern"
    },
    "field": {
      "title": "Description",
      "description": "Prose: text of at least one character whose only control characters are line feeds and tabs, neither beginning nor ending with a space, a line feed or a tab."
    },
    "params": {
      "pattern": "^[^\u0000- -]([^\u0000-\b\u000b-\u001f-]*[^\u0000- -])?$"
    }
  }
]
