[
  {
    "code": "template.filter_argument",
    "severity": "error",
    "subject": {
      "kind": "template",
      "name": "templates/a.txt.liquid"
    },
    "location": {
      "origin": "package",
      "file": "templates/a.txt.liquid",
      "line": 1,
      "column": 1
    },
    "params": {
      "filter": "json",
      "argument": "indent",
      "column": 1
    }
  },
  {
    "code": "template.filter_argument",
    "severity": "error",
    "subject": {
      "kind": "template",
      "name": "templates/a.txt.liquid"
    },
    "location": {
      "origin": "package",
      "file": "templates/a.txt.liquid",
      "line": 2,
      "column": 1
    },
    "params": {
      "filter": "json",
      "argument": "1",
      "column": 1
    }
  },
  {
    "code": "template.filter_argument",
    "severity": "error",
    "subject": {
      "kind": "template",
      "name": "templates/a.txt.liquid"
    },
    "location": {
      "origin": "package",
      "file": "templates/a.txt.liquid",
      "line": 3,
      "column": 1
    },
    "params": {
      "filter": "yaml",
      "argument": "pretty",
      "column": 1
    }
  },
  {
    "code": "template.filter_argument",
    "severity": "error",
    "subject": {
      "kind": "template",
      "name": "templates/a.txt.liquid"
    },
    "location": {
      "origin": "package",
      "file": "templates/a.txt.liquid",
      "line": 4,
      "column": 1
    },
    "params": {
      "filter": "csv",
      "argument": "delimiter",
      "column": 1
    }
  },
  {
    "code": "template.filter_argument",
    "severity": "error",
    "subject": {
      "kind": "template",
      "name": "templates/a.txt.liquid"
    },
    "location": {
      "origin": "package",
      "file": "templates/a.txt.liquid",
      "line": 5,
      "column": 1
    },
    "params": {
      "filter": "csv",
      "argument": "2",
      "column": 1
    }
  },
  {
    "code": "template.filter_argument",
    "severity": "error",
    "subject": {
      "kind": "template",
      "name": "templates/a.txt.liquid"
    },
    "location": {
      "origin": "package",
      "file": "templates/a.txt.liquid",
      "line": 6,
      "column": 1
    },
    "params": {
      "filter": "csv",
      "argument": "header",
      "column": 1
    }
  },
  {
    "code": "template.filter_argument",
    "severity": "error",
    "subject": {
      "kind": "template",
      "name": "templates/a.txt.liquid"
    },
    "location": {
      "origin": "package",
      "file": "templates/a.txt.liquid",
      "line": 7,
      "column": 1
    },
    "params": {
      "filter": "markdown_table",
      "argument": "delimiter",
      "column": 1
    }
  },
  {
    "code": "template.filter_argument",
    "severity": "error",
    "subject": {
      "kind": "template",
      "name": "templates/a.txt.liquid"
    },
    "location": {
      "origin": "package",
      "file": "templates/a.txt.liquid",
      "line": 8,
      "column": 1
    },
    "params": {
      "filter": "markdown_table",
      "argument": "headers",
      "column": 1
    }
  },
  {
    "code": "template.filter_argument",
    "severity": "error",
    "subject": {
      "kind": "template",
      "name": "templates/a.txt.liquid"
    },
    "location": {
      "origin": "package",
      "file": "templates/a.txt.liquid",
      "line": 9,
      "column": 1
    },
    "params": {
      "filter": "slug",
      "argument": "1",
      "column": 1
    }
  },
  {
    "code": "template.filter_argument",
    "severity": "error",
    "subject": {
      "kind": "template",
      "name": "templates/a.txt.liquid"
    },
    "location": {
      "origin": "package",
      "file": "templates/a.txt.liquid",
      "line": 10,
      "column": 1
    },
    "params": {
      "filter": "date",
      "argument": "1",
      "column": 1
    }
  },
  {
    "code": "template.filter_argument",
    "severity": "error",
    "subject": {
      "kind": "template",
      "name": "templates/a.txt.liquid"
    },
    "location": {
      "origin": "package",
      "file": "templates/a.txt.liquid",
      "line": 11,
      "column": 1
    },
    "params": {
      "filter": "date",
      "argument": "2",
      "column": 1
    }
  },
  {
    "code": "template.date_format",
    "severity": "error",
    "subject": {
      "kind": "template",
      "name": "templates/b.txt.liquid"
    },
    "location": {
      "origin": "package",
      "file": "templates/b.txt.liquid",
      "line": 1,
      "column": 1
    },
    "params": {
      "directive": "%Q",
      "column": 1
    }
  },
  {
    "code": "template.date_format",
    "severity": "error",
    "subject": {
      "kind": "template",
      "name": "templates/c.txt.liquid"
    },
    "location": {
      "origin": "package",
      "file": "templates/c.txt.liquid",
      "line": 1,
      "column": 1
    },
    "params": {
      "column": 1
    }
  },
  {
    "code": "template.date_format",
    "severity": "error",
    "subject": {
      "kind": "template",
      "name": "templates/d.txt.liquid"
    },
    "location": {
      "origin": "package",
      "file": "templates/d.txt.liquid",
      "line": 1,
      "column": 1
    },
    "params": {
      "directive": "%#",
      "column": 1
    }
  },
  {
    "code": "template.date_format",
    "severity": "error",
    "subject": {
      "kind": "template",
      "name": "templates/e.txt.liquid"
    },
    "location": {
      "origin": "package",
      "file": "templates/e.txt.liquid",
      "line": 1,
      "column": 1
    },
    "params": {
      "directive": "%--",
      "column": 1
    }
  },
  {
    "code": "template.date_format",
    "severity": "error",
    "subject": {
      "kind": "template",
      "name": "templates/f.txt.liquid"
    },
    "location": {
      "origin": "package",
      "file": "templates/f.txt.liquid",
      "line": 1,
      "column": 1
    },
    "params": {
      "directive": "%",
      "column": 1
    }
  },
  {
    "code": "template.filter_argument",
    "severity": "error",
    "subject": {
      "kind": "template",
      "name": "templates/g.txt.liquid"
    },
    "location": {
      "origin": "package",
      "file": "templates/g.txt.liquid",
      "line": 1,
      "column": 1
    },
    "params": {
      "filter": "date",
      "argument": "1",
      "column": 1
    }
  }
]
