[
  {
    "code": "output.path.character",
    "severity": "error",
    "subject": {
      "kind": "output",
      "name": "placed"
    },
    "location": {
      "origin": "package",
      "file": "metais.yaml",
      "line": 11,
      "column": 11,
      "pointer": "/outputs/0/path"
    },
    "params": {
      "path": "a‮b.txt",
      "code_point": 8238
    }
  }
]
